bossName,bossDifficulty,bossReqQuest,bossReqLevel,bossLevel, bossHP ,bossHPStr,bossHPperPhase,isHpRevision,bossDef,bossForce,rewardItem1,rewardItem1Name,rewardItem2,rewardItem2Name,rewardItem3,rewardItem3Name,rewardItem4,rewardItem4Name,bossPattern1,bossPattern2,bossPattern3,bossPattern4,bossTip
반반,노말,퀘스트 전구 - [루타비스],125,120," 315,000,000 ",3억 1500만,0,1,50,아케인/어센틱 없음,04001886,약 50만 메소,04001886,약 900만 메소,,,,,전방으로 에너지볼을 발사합니다.\\n최대 체력의 50% 피해를 주며 기절,전방으로 에너지볼을 발사합니다.\\n즉사 피해,,,반반의 행동은 생각보다 빠릅니다. 단순히 눈으로만 보고 패턴에 대응하는 것만으론 피할 수 없을 겁니다. 반반이 어떤 패턴을 쓸지 미리 예상해보세요.
반반,카오스,퀘스트 전구 - [루타비스],180,190," 100,000,000,000 ",1000억,0,1,100,아케인/어센틱 없음,02000004,엘릭서,02730002,수상한 에디셔널 큐브,,,,,앞에 있는 플레이어를 지팡이로 내려칩니다.\\n최대 체력의 20% 피해,앞에 있는 플레이어를 지팡이로 내려칩니다.\\n최대 체력의 20% 피해를 주며 기절,,,"플레이어를 강제 텔레포트 시키는 패턴과 반반의 점프, 또는 에너지볼 패턴이 겹치면, 절대 공격을 피할 수 없는 상황이 되기도 합니다. "
,,,,,,,,,,,01003716,반반 투구,02000005,파워 엘릭서,,,,,플레이어에게 마법을 걸어 일정 시간이 지나면 플레이어가 있던 위치로 텔레포트 시킵니다.,반반이 텔레포트로 플레이어에게 접근합니다.,,,"강제 텔레포트 디버프를 받게 되면, 원래 있던 위치에서 반대쪽으로 이동하세요. 텔레포트 되었을 때 에너지볼 위협을 피할 수 있습니다."
,,,,,,,,,,,03010512,반반과 함께 의자,02434584,시간의 조각(루타비스 상의),,,,,"반반의 체력이 100% ~ 40% 일 때 : 시간의 틈새에 균열을 일으킵니다. 반반이 흰색 시계 마법진에 있을 경우 남은 시간이 줄어들고, 검은색 시계 마법진에 있을 경우 남은 시간이 늘어납니다.","반반의 체력이 100% ~ 40% 일 때 : 시간의 틈새에 균열을 일으킵니다. 반반이 흰색 시계 마법진에 있을 경우 남은 시간이 줄어들고, 검은색 시계 마법진에 있을 경우 남은 시간이 늘어납니다.",,,
,,,,,,,,,,,,,01003716,카오스 반반 투구,,,,,"반반의 체력이 70% ~ 15% 일 때 : 공중으로 점프 한 뒤, 지면을 강하게 내려칩니다. 지면에 있는 플레이어가 모두 피해를 받습니다.\\n최대 체력의 90% 피해를 주며 기절시킵니다.",반반의 체력이 70% ~ 15% 일 때 : 플레이어에게 마법을 걸어 일정 시간이 지나면 플레이어가 있던 위치로 텔레포트 시킵니다.\\n느려짐 상태이상,,,
,,,,,,,,,,,,,,,,,,,"반반의 체력이 15% 이하일 때 : 반반이 사라진 뒤, 랜덤 위치에 나타나며 날개를 펼쳐 폭풍을 일으킵니다.\\n최대 체력의 30% 피해를 받으며 넉백","반반의 체력이 70% ~ 15% 일 때 : 공중으로 점프 한 뒤, 지면을 강하게 내려칩니다. 지면에 있는 플레이어가 모두 피해를 받습니다.\\n즉사 피해",,,
,,,,,,,,,,,,,,,,,,,,"반반의 체력이 40% ~ 15% 일 때 : 반반이 내면세계로 사라집니다. 랜덤 위치에 반반의 내면세계로 통하는 포탈이 생기는데, 포탈 안으로 들어가 제한시간 안에 반반의 무의식을 처치해야 합니다. 실패 시 시공간이 붕괴하며 모든 파티원이 즉사.",,,
,,,,,,,,,,,,,,,,,,,,"반반의 체력이 15% 이하일 때 : 반반이 사라진 뒤, 랜덤 위치에 나타나며 날개를 펼쳐 폭풍을 일으킵니다.\\n최대 체력의 30% 피해를 받으며 넉백",,,
,,,,,,,,,,,,,,,,,,,,반반의 체력이 15% 이하일 때 : 하늘에서 운석이 떨어집니다.\\n초록 : 최대 체력의 33% 피해\\n파랑 : 최대 체력의 33% 피해\\n보라 : 즉사 피해,,,
