bossName,bossDifficulty,bossReqQuest,bossReqLevel,bossLevel, bossHP ,bossHPStr,bossHPperPhase,isHpRevision,bossDef,bossForce,rewardItem1,rewardItem1Name,rewardItem2,rewardItem2Name,rewardItem3,rewardItem3Name,rewardItem4,rewardItem4Name,bossPattern1,bossPattern2,bossPattern3,bossPattern4,bossTip
힐라,노말,없음,120,110," 500,000,000 ",5억,0,1,50,아케인/어센틱 없음,04001886,약 50만 메소,04001886,약 700만 메소,,,,,특정 지역에 비석을 소환합니다. 비석은 짧은 시간이 지나면 폭발합니다.\\n최대 체력의 40% 피해,"힐라가 많은 스켈레톤 몬스터들을 소환한 뒤, 몬스터들을 이용하여 빠른 속도로 자신의 HP를 회복합니다.",,,"힐라가 소환하는 잡몹은 계속해서 힐라의 체력을 회복시킬 겁니다. 잡몹이 소환되었다면, 그리고 자신의 딜량이 회복 속도를 따라잡을 수 없다면, 빠르게 잡몹을 처리하세요."
힐라,하드,없음,170,190," 16,800,000,000 ",168억,0,1,100,아케인/어센틱 없음,02000004,엘릭서,02000005,파워 엘릭서,,,,,"힐라가 잠시 정신 집중을 한 뒤, 모든 지역에 범위 공격을 합니다. 메디사의 마법진에 들어가면 회피\\n피격 시 최대 체력의 50% 피해","데들리 알타를 소환합니다. 데들리 알타는 플레이어를 데들리 알타가 있는 곳으로 끌어옵니다. HP : 200,000,000 (2억)",,,
,,,,,,,,,,,01052784,네크로 장비,01052784,네크로 장비,,,,,데들리 알타를 소환합니다. 데들리 알타는 플레이어를 데들리 알타가 있는 쪽으로 끌어옵니다.,특정 지역에 비석을 소환합니다. 비석은 짧은 시간이 지나면 폭발합니다.\\n최대 체력의 40% 피해,,,
,,,,,,,,,,,01162009,영생의 돌,01162009,영생의 돌,,,,,"힐라가 저주 상태이상을 겁니다. 이 상태이상에 걸리면 힐라에게서 받는 데미지가 1.5배 상승합니다. 단, 최대 체력에 비례하는 데미지는 상승하지 않습니다.","힐라가 잠시 정신 집중을 한 뒤, 모든 지역에 범위 공격을 합니다. 메디사의 마법진에 들어가면 회피\\n즉사 피해",,,
,,,,,,,,,,,05000217,다크소울 (펫),05000217,다크소울 (펫),,,,,힐라가 번개 공격을 합니다.\\n2초 동안 기절 상태이상,"힐라가 저주 상태이상을 겁니다. 이 상태이상에 걸리면 힐라에게서 받는 데미지가 1.5배 상승합니다. 단, 최대 체력에 비례하는 데미지는 상승하지 않습니다.",,,
,,,,,,,,,,,,,01032136,지옥의 불꽃,,,,,힐라가 공격 반사 버프를 사용합니다.,힐라가 번개 공격을 합니다.\\n2초 동안 기절 상태이상,,,
,,,,,,,,,,,,,,,,,,,,힐라가 공격 반사 버프를 사용합니다.,,,
,,,,,,,,,,,,,,,,,,,,"체력이 50% 이하일 때 : 힐라가 백발모드로 변하며, 아스완의 유령을 소환한 뒤 무적 상태가 됩니다. 아스완의 유령을 모두 처치하면 힐라의 무적 상태가 사라집니다. 아스완의 유령 HP : 330,000,000 (3억 3000만)",,,
