bossName,bossDifficulty,bossReqQuest,bossReqLevel,bossLevel, bossHP ,bossHPStr,bossHPperPhase,isHpRevision,bossDef,bossForce,rewardItem1,rewardItem1Name,rewardItem2,rewardItem2Name,rewardItem3,rewardItem3Name,rewardItem4,rewardItem4Name,bossPattern1,bossPattern2,bossPattern3,bossPattern4,bossTip
반 레온,이지,엘나스 - [사자왕의 성],125,120," 700,000,000 ",7억,0,0,50,아케인/어센틱 없음,04001886,약 60만 메소,04001886,약 80만 메소,04001886,약 150만 메소,04001886,약 0만 메소,눈에서 레이저를 발사합니다\\n최대 체력의 50% 피해,눈에서 레이저를 발사합니다\\n즉사 피해,눈에서 레이저를 발사합니다\\n즉사 피해,,"[안광] 패턴을 항상 조심하세요. 눈에서 빛이 난다면, 멀리 떨어지세요."
반 레온,노말,엘나스 - [사자왕의 성],125,129," 6,300,000,000 ",63억,0,0,80,아케인/어센틱 없음,04310010,사자왕의 로얄 메달,04310010,사자왕의 로얄 메달,02000005,파워 엘릭서,,,플레이어의 위치로 순간이동 합니다.,플레이어의 위치로 순간이동 합니다.,플레이어의 위치로 순간이동 합니다.,,주먹으로 바닥을 내려찍는 패턴은 매우 아픕니다. 
반 레온,하드,엘나스 - [사자왕의 성],125,150," 10,500,000,000 ",105억,0,0,80,아케인/어센틱 없음,02022003,회복 아이템,02000005,파워 엘릭서,01052804,로얄 반 레온 장비,,,"많은 몬스터들을 소환하고, 몬스터를 통해 체력을 회복합니다.","많은 몬스터들을 소환하고, 몬스터를 통해 체력을 회복합니다.","많은 몬스터들을 소환하고, 몬스터를 통해 체력을 회복합니다.",,
,,,,,,,,,,,,,,,01122274,이피아의 장신구,,,공격 반사 버프를 사용합니다.,공격 반사 버프를 사용합니다.,공격 반사 버프를 사용합니다.,,
,,,,,,,,,,,,,,,,,,,플레이어를 공중 감옥으로 쫓아냅니다. 공중 감옥에 있는 상자에서 열쇠를 찾아야 돌아갈 수 있습니다.,플레이어를 공중 감옥으로 쫓아냅니다. 공중 감옥에 있는 상자에서 열쇠를 찾아야 돌아갈 수 있습니다.,플레이어를 공중 감옥으로 쫓아냅니다. 공중 감옥에 있는 상자에서 열쇠를 찾아야 돌아갈 수 있습니다.,,
,,,,,,,,,,,,,,,,,,,"팔을 든 뒤, 바닥에 내려찍습니다.","팔을 든 뒤, 바닥에 내려찍습니다.\\n최대 체력의 50% 피해","팔을 든 뒤, 바닥에 내려찍습니다.\\n최대 체력의 90% 피해",,
,,,,,,,,,,,,,,,,,,,바닥을 내리쳐 번개를 일으킵니다.,바닥을 내리쳐 번개를 일으킵니다.,바닥을 내리쳐 번개를 일으킵니다.,,
,,,,,,,,,,,,,,,,,,,손톱으로 전방을 할큅니다.\\n최대 체력의 20% 피해,손톱으로 전방을 할큅니다.\\n최대 체력의 20% 피해,손톱으로 전방을 할큅니다.\\n최대 체력의 20% 피해,,
,,,,,,,,,,,,,,,,,,,"큰 포효를 내지릅니다.\\n최대 체력의 20% 피해, 스턴 상태이상","큰 포효를 내지릅니다.\\n최대 체력의 20% 피해, 스턴 상태이상","큰 포효를 내지릅니다.\\n최대 체력의 20% 피해, 스턴 상태이상",,
