0,0000073,여제의 축복,패시브,30,"다른 시그너스 캐릭터와 미하일 캐릭터를 레벨 5이상 육성하면 스킬포인트 1이 증가한다. 단, 정령의 축복과 여제의 축복중 높은 효과로 발동된다.\\n다른 시그너스, 미하일 캐릭터의 고귀한 정신에 의해 마스터 레벨이 최대 30까지 확장될 수 있다. ","공격력 30, 마력 30 증가",0
0,0001005,영웅의 메아리,전체 버프,1,주변 모든 캐릭터의 공격력과 마력을 증가시킨다.,"MP 30 소비하여 40분 동안 공격력, 마력 4% 증가",300
7,2141000,플레임 스윕 VI,스킬 강화,30,"전방을 강력한 화염으로 휩쓴다. 플레임 스윕이 적중할 때마다 열기가 남아 일정량 이상 쌓이면 더 거대한 화염으로 발화한다.\\n거대 화염은 적중한 적에 불씨를 남기고, 불씨가 있는 적에게 미스트 이럽션 적중 시 불씨가 독에 반응하여 폭발한다.\\n플레임 스윕의 모든 화염에 적중한 적은 화상을 입어 지속적으로 도트 데미지를 입는다. 일부 몬스터는 저항하여 화상을 입지 않는다. 불 속성 공격이다.\\n필요 스킬 : 플레임 스윕 30레벨 이상","MP 52 소비, 최대 8명의 적을 239% / 355%의 데미지로 7번 공격\\n플레임 스윕 2회 적중 시 다음 플레임 스윕은 거대 화염 발생\\n거대 화염에 적중한 적은 30초 동안 불씨가 남아 미스트 이럽션 적중 시 143% / 375%의 데미지로 8번 공격하는 폭발 발생\\n플레임 스윕의 모든 화염에 적중한 적은 5초 동안 화상을 입으며 1초당 261% / 435%의 도트 데미지",0
7,2141003,플레임 헤이즈 VI,스킬 강화,30,적을 타오르는 독안개로 감싸 부딪히지 않는 상태로 만들고 도트 데미지를 입히며 느려지게 만든다.\\n필요 스킬 : 플레임 헤이즈 30레벨 이상,"MP 73 / 83 소비, 219% / 335%의 데미지로 15번 공격\\n100% 확률로 10초 동안 209% / 325% 도트 데미지를 주며 부딪히지 않는 상태 지속 및 -51% 감속\\n적중 시 적 위치에 포이즌 미스트 생성, 적중한 적이 없을 경우 자신 위치에 포이즌 미스트 생성",10
7,2141500,인페르날 베놈,액티브,30,"불과 독의 화신이 가진 본래의 힘을 해방시켜 궁극의 융합 마법으로 주위를 초토화시킨다.\\n두 화신의 힘으로 일정 시간 동안 퍼번트 드레인의 한계가 확장되며, 최대 스택으로 고정된다. 공격 반사 상태의 적을 공격해도 피해를 입지 않는다.\\n10레벨 : 몬스터 방어율 무시 20% 증가\\n20레벨 : 보스 몬스터 공격 시 데미지 20% 증가\\n30레벨 : 몬스터 방어율 무시 30% 증가, 보스 몬스터 공격 시 데미지 30% 증가","MP 1500 소비, 시전 동작 중 무적\\n20초 동안 퍼번트 드레인의 한계치가 10스택으로 확장\\n불과 독의 화신이 해방되어 15명의 적을 279% / 540%의 데미지로 12번 공격하는 폭발이 17회 발생\\n두 화신의 마력이 융합하여 최대 15명의 적을 269% / 530%의 데미지로 15번 공격하는 강력한 폭렬 마법이 42회 발생",360
7,2141005,미스트 이럽션 VI,스킬 강화,30,주변에 설치된 포이즌 미스트들을 폭발시켜 적에게 치명적인 독 속성 데미지를 준다. 대상에게 적용된 도트의 수가 많을수록 더 큰 피해를 줄 수 있으며 다른 사람이 설치한 미스트는 폭발시킬 수 없다.\\n재사용 대기시간 초기화의 효과를 받지 않고 미스트 폭발에 성공하면 플레임 헤이즈의 재사용 대기시간이 초기화된다.,"MP 100 / 115 소비, 최대 12명의 적을 128% / 215%의 데미지로 10번 공격하는 폭발 2번 발생\\n몬스터의 방어율을 45% 무시\\n대상에게 적용된 도트의 개수가 2개 일 때 20%, 3개 일 때 54%, 4개 일 때 104%, 5개 일 때 170% 만큼 폭발의 최종 데미지 증가\\n최대 6개의 미스트 동시 폭발 가능\\n도트가 5개 이상 적용된 적에게 미스트 이럽션을 적중시키면 미스트 이럽션의 재사용 대기시간 2초 감소, 도트 5중첩으로 인한 재사용 대기시간 감소는 다른 재사용 대기시간 감소 기능보다 먼저 적용",10
7,400021001,도트 퍼니셔 강화,스킬 강화,30,도트 퍼니셔를 강화한다.,도트 퍼니셔의 최종 데미지 11% / 60% 증가,0
7,400021028,포이즌 노바 강화,스킬 강화,30,포이즌 노바를 강화한다.,포이즌 노바의 최종 데미지 11% / 60% 증가,0
7,400021066,퓨리 오브 이프리트 강화,스킬 강화,30,퓨리 오브 이프리트를 강화한다.,퓨리 오브 이프리트의 최종 데미지 11% / 60% 증가,0
7,400021101,포이즌 체인 강화,스킬 강화,30,포이즌 체인을 강화한다.,포이즌 체인의 최종 데미지 11% / 60% 증가,0
